[
  {
    "claim_type": "compound_disorder",
    "compound": "Ketamine",
    "disorder": "not_applicable",
    "raw_entity_label": "Emergence agitation (EA)",
    "entity_role": "symptom_or_problem",
    "clinical_context_condition": "Post-traumatic stress disorder patients undergoing gynecological laparoscopic surgery",
    "graph_entity_label": "none",
    "graph_entity_type": "none",
    "graph_include_candidate": false,
    "graph_exclusion_reason": "Perioperative outcome, not a core therapeutic indication for the knowledge graph.",
    "outcome_type": "clinical_outcome",
    "outcome_domain": "psychiatric_symptoms",
    "result_direction": "positive",
    "outcome_measure": "Riker sedation-agitation scores",
    "population": "Adult women (18-45 years old) with PTSD",
    "system": "clinical",
    "study_title": "Effect of three modalities on emergence agitation among post-traumatic stress disorder patients undergoing laparoscopy: a randomized controlled study",
    "authors": "Heba Ahmed Abdelaziz; Yomna E. Dean; Ahmed Mohamed Ahmed Elshafie",
    "study_year": 2024,
    "paper_type": "primary_results",
    "source": "doi",
    "source_type": "primary_study",
    "source_family": "original_empirical",
    "paper_assessment_route": "primary_evidence",
    "evidence_strength": "uncertain",
    "support": "supported",
    "confidence": 1.0,
    "needs_human_review": false,
    "supporting_quote": "On Riker sedation-agitation scores, group 2 was 175 times more likely to be non-agitated (175 (19.932-1536.448), p<0.001)",
    "access_level": "full_text_seen",
    "evidence_location": "abstract",
    "evidence_locator": "C001",
    "study_design": "randomized control trial",
    "funding": "",
    "conflicts_of_interest": "",
    "risk_of_bias_summary": "",
    "notes": "Projected from extraction_v1; support=supported; confidence=1.0; needs_human_review=False",
    "study_doi": "10.1186/s12888-024-05525-5",
    "study_journal": "BMC Psychiatry",
    "publication_type": "journal-article",
    "publication_date": "2024-01-29",
    "journal_issn": "1471-244X",
    "journal_eissn": "1471-244X",
    "publisher": "Springer Science and Business Media LLC",
    "mesh_terms": "Adult | Humans | Female | Adolescent | Young Adult | Middle Aged | Ketamine | Emergence Delirium / etiology | Emergence Delirium / prevention & control | Stress Disorders, Post-Traumatic / etiology | Pandemics | Laparoscopy",
    "keywords": "Anesthesia | Breathing | Emergence agitation | Ketamine | PTSD",
    "language": "eng",
    "sample_size_total": "144",
    "comparator": "control group",
    "intervention_or_exposure": "intra-operative Ketamine",
    "dose": "0.5 mg/Kg",
    "route": "intravenous",
    "session_count_or_duration": "single intra-operative administration",
    "timepoint": "emergence from anesthesia",
    "effect_size": "",
    "p_value": "",
    "confidence_interval": "",
    "adverse_events": "not_reported",
    "evidence_level": "high"
  },
  {
    "claim_type": "compound_disorder",
    "compound": "Ketamine",
    "disorder": "not_applicable",
    "raw_entity_label": "Emergence agitation (EA)",
    "entity_role": "symptom_or_problem",
    "clinical_context_condition": "Post-traumatic stress disorder patients undergoing gynecological laparoscopic surgery",
    "graph_entity_label": "none",
    "graph_entity_type": "none",
    "graph_include_candidate": false,
    "graph_exclusion_reason": "Perioperative outcome, not a core therapeutic indication for the knowledge graph.",
    "outcome_type": "clinical_outcome",
    "outcome_domain": "psychiatric_symptoms",
    "result_direction": "positive",
    "outcome_measure": "Riker sedation-agitation scores",
    "population": "Adult women (18-45 years old) with PTSD",
    "system": "clinical",
    "study_title": "Effect of three modalities on emergence agitation among post-traumatic stress disorder patients undergoing laparoscopy: a randomized controlled study",
    "authors": "Heba Ahmed Abdelaziz; Yomna E. Dean; Ahmed Mohamed Ahmed Elshafie",
    "study_year": 2024,
    "paper_type": "primary_results",
    "source": "doi",
    "source_type": "primary_study",
    "source_family": "original_empirical",
    "paper_assessment_route": "primary_evidence",
    "evidence_strength": "uncertain",
    "support": "supported",
    "confidence": 1.0,
    "needs_human_review": false,
    "supporting_quote": "On Riker sedation-agitation scores, ... group 3 was protected against agitation.",
    "access_level": "full_text_seen",
    "evidence_location": "abstract",
    "evidence_locator": "C001",
    "study_design": "randomized control trial",
    "funding": "",
    "conflicts_of_interest": "",
    "risk_of_bias_summary": "",
    "notes": "Projected from extraction_v1; support=supported; confidence=1.0; needs_human_review=False",
    "study_doi": "10.1186/s12888-024-05525-5",
    "study_journal": "BMC Psychiatry",
    "publication_type": "journal-article",
    "publication_date": "2024-01-29",
    "journal_issn": "1471-244X",
    "journal_eissn": "1471-244X",
    "publisher": "Springer Science and Business Media LLC",
    "mesh_terms": "Adult | Humans | Female | Adolescent | Young Adult | Middle Aged | Ketamine | Emergence Delirium / etiology | Emergence Delirium / prevention & control | Stress Disorders, Post-Traumatic / etiology | Pandemics | Laparoscopy",
    "keywords": "Anesthesia | Breathing | Emergence agitation | Ketamine | PTSD",
    "language": "eng",
    "sample_size_total": "144",
    "comparator": "control group",
    "intervention_or_exposure": "pre-operative relaxation techniques and intra-operative Ketamine",
    "dose": "0.5 mg/Kg",
    "route": "intravenous",
    "session_count_or_duration": "single intra-operative administration",
    "timepoint": "emergence from anesthesia",
    "effect_size": "",
    "p_value": "",
    "confidence_interval": "",
    "adverse_events": "not_reported",
    "evidence_level": "high"
  },
  {
    "claim_type": "compound_disorder",
    "compound": "Ketamine",
    "disorder": "pain",
    "raw_entity_label": "thermal nociceptive threshold",
    "entity_role": "outcome_measure",
    "clinical_context_condition": "not_applicable",
    "graph_entity_label": "pain",
    "graph_entity_type": "indication",
    "graph_include_candidate": true,
    "graph_exclusion_reason": "not_applicable",
    "outcome_type": "therapeutic_effect",
    "outcome_domain": "pain",
    "result_direction": "positive",
    "outcome_measure": "thermal nociceptive threshold",
    "population": "C57BL/6J female mice",
    "system": "preclinical",
    "study_title": "Intranasal Ketamine for Acute Pain: Behavioral and Neurophysiological Safety Analysis in Mice.",
    "authors": "Goswami N; Aleem M; Manda K",
    "study_year": 2021,
    "paper_type": "primary_results",
    "source": "doi",
    "source_type": "primary_study",
    "source_family": "original_empirical",
    "paper_assessment_route": "primary_evidence",
    "evidence_strength": "uncertain",
    "support": "supported",
    "confidence": 1.0,
    "needs_human_review": false,
    "supporting_quote": "INK administration significantly augmented the thermal nociceptive threshold and alleviated the pain response in the tonic phase of the formalin test. The results showed the dose-independent effectiveness of ketamine for thermal nociceptive responses because there were no significant differences among different INK dose groups.",
    "access_level": "full_text_seen",
    "evidence_location": "abstract",
    "evidence_locator": "C001, C011, F001",
    "study_design": "Experimental animal study",
    "funding": "",
    "conflicts_of_interest": "",
    "risk_of_bias_summary": "",
    "notes": "Projected from extraction_v1; support=supported; confidence=1; needs_human_review=False",
    "study_doi": "10.1016/j.curtheres.2021.100627",
    "study_journal": "Current therapeutic research, clinical and experimental",
    "publication_type": "Journal Article",
    "publication_date": "2021-03-11",
    "journal_issn": "0011-393X",
    "keywords": "behavior | ketamine | neurophysiological safety | pain | phenotyping",
    "language": "eng",
    "sample_size_total": "n=7 per group",
    "comparator": "control (saline)",
    "intervention_or_exposure": "Intranasal ketamine (INK)",
    "dose": "20 mg/kg, 5 mg/kg, and 1 mg/kg",
    "route": "intranasal",
    "session_count_or_duration": "single administration",
    "timepoint": "30 minutes post-administration",
    "effect_size": "",
    "p_value": "",
    "confidence_interval": "",
    "adverse_events": "not_reported",
    "evidence_level": "low"
  },
  {
    "claim_type": "compound_disorder",
    "compound": "Ketamine",
    "disorder": "pain",
    "raw_entity_label": "pain response in the tonic phase of the formalin test",
    "entity_role": "outcome_measure",
    "clinical_context_condition": "not_applicable",
    "graph_entity_label": "pain",
    "graph_entity_type": "indication",
    "graph_include_candidate": true,
    "graph_exclusion_reason": "not_applicable",
    "outcome_type": "therapeutic_effect",
    "outcome_domain": "pain",
    "result_direction": "positive",
    "outcome_measure": "formalin-induced pain (tonic phase)",
    "population": "C57BL/6J female mice",
    "system": "preclinical",
    "study_title": "Intranasal Ketamine for Acute Pain: Behavioral and Neurophysiological Safety Analysis in Mice.",
    "authors": "Goswami N; Aleem M; Manda K",
    "study_year": 2021,
    "paper_type": "primary_results",
    "source": "doi",
    "source_type": "primary_study",
    "source_family": "original_empirical",
    "paper_assessment_route": "primary_evidence",
    "evidence_strength": "uncertain",
    "support": "supported",
    "confidence": 1.0,
    "needs_human_review": false,